### DISCUSSION TITLE
Force a bubblejail profile to have a dedicated outbound IP (from the router perspective)

### DISCUSSION THREAD

**Discussion by 0x192** [igo95862/bubblejail#170] [Q&A] [answered]
Hello,

I'm trying to setup a bubblejail profile for Firefox which will be forced to leave with a specific outbound IP. On the router I will then be able to force the use of a filtering proxy to access the internet for this IP. This IP cannot be spoofable from inside the bubblejail profile.

Unfortunately, I don't find a "easy" way to configure this. `slirp4netns` allows me to bind to a dedicated interface (call it `proxy`) but this will still be routed via the default outbound IP of my `wlan0` interface.  The routing `proxy` -> `wlan0` is done directly in the kernel (scope host) and is not seen by nftables so I can't configure a simple SNAT rule.

Running the bubblejail firefox profile in a network namespace is not a real solution to me as it needs `CAP_NET_ADMIN`.

I'm currently trying to hack a bit with a dedicated routing table but so far I haven't managed to get it to work properly.

Is there an alternative I haven't considered, or has anyone else already done something similar?

Thank you!

PS: @igo95862 Thank you for your massive work on Bubblejail!

**Comment by 0x192** [comment]
@rusty-snake if you're coming around... Your expertise is welcomed!  :)

**Reply by rusty-snake** [reply]
Unfortunately my networking knowledge is also limited, otherwise I would had https://codeberg.org/crabjail/crablock/issues/67 already be implemented.

(Assuming no XY-Problem here and a dedicated outbound IP for firefox is necessary)

Am I right that what you want is like the following (from a Router PoV):

```mermaid
flowchart LR
    R[(Router)]
    subgraph C [Computer]
        direction LR
        N(''normal'' Program)
        F(Firefox)
    end
    N  <-->|192.168.0.20| R
    F  <-->|192.168.0.21| R
```

This should be possible, however I'm not aware of an "easy" way. Also I guess there is more than one way.

**Reply by igo95862** [reply]
> Unfortunately my networking knowledge is also limited, otherwise I would had https://codeberg.org/crabjail/crablock/issues/67 already be implemented.

Have you heard about torsocks: https://github.com/dgoulet/torsocks

**Reply by rusty-snake** [reply]
(OT: Yes. However the goal is to not relay on hacks like `LD_PRELOAD`, … but do it via transparent routing. A bit like https://github.com/orjail/orjail but fully unprivileged, with one or two network namespaces and pasta.)

**Reply by igo95862** [reply]
Pretty sure it is possible to modify `slirp4netns` to use SOCKS5 proxies.

**Comment by igo95862** [comment]
Hello @0x192 

> Unfortunately, I don't find a "easy" way to configure this. `slirp4netns` allows me to bind to a dedicated interface (call it `proxy`) but this will still be routed via the default outbound IP of my `wlan0` interface. The routing `proxy` -> `wlan0` is done directly in the kernel (scope host) and is not seen by nftables so I can't configure a simple SNAT rule.

Not sure I quite understand. Can you draw a diagram? Is it something like this?

Before:

```
host -> router -> internet
```

After:

```
host --------> router -> internet
           ^
bubblejail |
```

Where bubblejail is using a different IP address.

In this case I believe you can create a VLAN device and then use `slirp4netns` to bind to it.

**Comment by 0x192** [comment, marked as answer]
Wow thank you for your quick answers!

The host is indeed my personal machine with bubblejail installed on it as in the @rusty-snake's diagram.

I found out during my other attempt with a VLAN device (after reading your reply @igo95862) that it was the nftables rules added by Mullvad VPN also installed on my computer which were causing trouble, even when testing my setup on a terminal excluded from the Wireguard tunnel ([using the split tunneling feature](https://mullvad.net/en/help/split-tunneling-with-the-mullvad-app)).

I share with you a working configuration of my setup! :tada:

-----

**What do I want?**
- I want some programs confined in their bubblejail profile on my personal computer to be forced to use the filtering proxy on my router. 
- I don't want all my traffic to go through the proxy and the solution to this is to discriminate with the source IP. The goal is thus to force the bubblejail profile to use a dedicated IP so that the router can block all traffic from this IP not coming to the proxy.

- I also have an extra difficulty. My laptop is connected to Mullvad VPN which prevents traffic to leak outside of the Wireguard tunnel by default. We need to exclude this traffic securely so that it can be analyzed by the proxy and then going through Mullvad. 
- The goal is to make sure all traffic still go through Mullvad in the end. I don't want to only have Mullvad on the router because if I use my laptop outside, I still want to automatically be routing through Mullvad VPN. I want to have Mullvad VPN on the router (for bubblejail when I'm home) and on the computer (for the rest and outside home).

> [!NOTE]
> Maybe I should just open a port in my router to be able to connect to it when I'm outside but I'm afraid it will too much reduce network performance.

I'm using Arch Linux with the Gnome DE ([waiting for the stable release of Cosmic Desktop!](https://blog.system76.com/post/cosmic-alpha-7-never-been-beta) :sparkles: ). The network is handled by [NetworkManager](https://wiki.archlinux.org/title/NetworkManager).

**STEP 1: Create a VLAN interface**  

This is going to be the vlan interface that bubblejail (with `slirp4netns`) will bind on. Let's call it `proxy`. My wifi interface is `wlan0`. I chose `vlan id 10` here but it doesn't really matter. 

```cmd
me@host:~ nmcli connection add type vlan con-name proxy dev wlan0 id 10 ipv4.address1 192.168.10.1/24 ipv4.method manual ipv6.method ignore ifname proxy
```

I don't want ipv6 in this setup but you may want to remove `ipv6.method ignore` if you want it.

The configuration file of the new `proxy` connection is available (root access needed) in `/etc/NetworkManager/system-connections/proxy.nmconnection`.

**STEP 2: Adding a dedicated IP** 

Add a new static IP on your internet interface (`wlan0` for me) which will be the outbound IP address used by the bubblejail profile(s). It has to be in the same subnet obviously and on this specific interface.
If you don't do that and SNAT to a new IP unknown to the router, it will do an ARP request to know what MAC address has this IP and your computer won't answer given that well... it is not its IP address.

> [!WARNING]
> Do not try to add an ip with `ip a add ...` because the IP will be removed after a reboot.

In my case, my computer is in a dedicated VLAN within the `172.16.10/24`  subnet. The router has a DHCP server so I need to make sure those addresses won't be provisioned for another device. My primary address is reserved based on the MAC address of my computer (with [Kea DHCP](https://kea.readthedocs.io/en/latest/arm/dhcp4-srv.html#host-reservations-in-dhcpv4)) and the pool is `"172.16.10.2 - 172.16.10.99"` .

I can thus use `172.16.10.100/24` as a second static IP:

```cmd
nmcli connection modify <SSID_of_your_router> ipv4.method manual ipv4.address1 172.16.10.10/24 ipv4.address2 172.16.10.100/24 ipv4.gateway 172.16.10.1 ipv4.dns 172.16.10.1
```

Here is a (simplified) output of a `ip -4 a` after our changes:
 
```cmd
me@host~> ip -4 a
1: lo: <LOOPBACK,UP,LOWER_UP>
    inet 127.0.0.1/8 scope host lo
       valid_lft forever preferred_lft forever

4: wlan0: <BROADCAST,MULTICAST,UP,LOWER_UP>
    inet 172.16.10.10/24 brd 172.16.10.255 scope global noprefixroute wlan0
       valid_lft forever preferred_lft forever
    inet 172.16.10.100/24 brd 172.16.10.255 scope global secondary noprefixroute wlan0
       valid_lft forever preferred_lft forever

5: proxy@wlan0: <BROADCAST,MULTICAST,UP,LOWER_UP>
    inet 192.168.10.1/24 brd 192.168.1.255 scope global noprefixroute proxy
       valid_lft forever preferred_lft forever

6: wg0-mullvad: <POINTOPOINT,UP,LOWER_UP>
    inet 10.146.75.196/32 scope global wg0-mullvad
       valid_lft forever preferred_lft forever
```

**STEP 3: Bubblejail configuration :sparkles:**

For this example, we will configure a dedicated Firefox instance. 

Be careful, using the `--profile firefox` which will override your `firefox.desktop` by default even if the profile name is different. You can add `--no-desktop-entry` but if you still want bubblejail to generate the Firefox *.desktop* template, you can do this: 

```shell
cp ~/.local/share/applications/firefox.desktop ~/.local/share/applications/firefox.desktop.bak
bubblejail create --profile firefox firefox-proxy
mv ~/.local/share/applications/firefox.desktop  ~/.local/share/applications/firefox-proxy.desktop
mv ~/.local/share/applications/firefox.desktop.bak ~/.local/share/applications/firefox.desktop
```

To be able to differentiate your 2 different Firefox instances, you can change the `Name[<cc>]` key in your `~/.local/share/applications/firefox-proxy.desktop` like this:

```
Name=Firefox (proxy)
Name[en_GB]=Firefox (proxy)
``` 

And update the desktop database:

```cmd
me@host~> update-desktop-database ~/.local/share/applications
```

Now we need to customize the Firefox bubblejail profile to bind to our `proxy` interface.

```cmd
me@host~> EDITOR=nano bubblejail edit firefox-proxy
```

```toml
[common]
executable_name = "/usr/bin/firefox"
share_local_time = false
filter_disk_sync = false
dbus_name = ""

[x11]

[wayland]

[slirp4netns]
dns_servers = [
   "172.16.10.1"
]
outbound_addr = "proxy"

[pipewire]

[notify]

[direct_rendering]
enable_aco = false

[home_share]
home_paths = [
    "Downloads",
]

[namespaces_limits]
user = -1
mount = 0
pid = 1
ipc = -1
net = -1
time = 0
uts = 0
cgroup = 0
```

I made some other changes (replaced `pulseaudio` with `pipewire` and added namespace limits which don't break Firefox internal sandboxing) but the most important one is the replacement of `[network]` by `[slirp4netns]`.

At this stage, our traffic inside the bubblejail profile will still be routed outside with the `172.16.10.10` IP because it's the default IP of our internet interface (`wlan0`).

**STEP 4: Firewall configuration**

We need to create a firewall SNAT rule to change the source address if it comes from the `proxy` interface.

If you are following this write-up, I guess you are technical enough to use plain nftables firewall instead of a frontend like ufw or firewalld.

Here is a working firewall configuration for this setup:

```cmd
me@host# cat /etc/nftables.conf
#!/usr/bin/nft -f

table inet filter
table inet exclude_mullvad

flush table inet exclude_mullvad
flush table inet filter

define IF_WAN = wlan0
define IP_PROXY = 192.168.10.1/24
define IP_WAN_PROXY = 172.16.10.100

table inet filter {

    chain input {
      type filter hook input priority filter; policy drop;

      ct state vmap { established : accept, related : drop, invalid : drop }
      iif lo accept

      counter log flags all prefix "fw_drop_input " drop
    }

    chain output {
      type filter hook output priority filter; policy accept;
    }

    chain forward {
      type filter hook forward priority filter; policy drop;

      ct state vmap { established : accept, related : drop, invalid : drop }

      counter log flags all prefix "fw_drop_forward " drop
   }

    chain postrouting {
      type nat hook postrouting priority 99; policy accept;
      ip saddr $IP_PROXY snat ip to $IP_WAN_PROXY
    }
}

table inet exclude_mullvad {
  chain output {
    type route hook output priority -100; policy accept;
    ip saddr $IP_PROXY ct mark set 0x00000f41 meta mark set 0x6d6f6c65
  }
}
```

I told you I had an extra difficulty because the Mullvad VPN app adds its own `inet table mullvad` to prevent traffic leak.

If you don't have a VPN connected on your computer, you can remove the table `exclude_mullvad` and do a proper `flush ruleset` at the top of the config file instead of the following (because we don't want to flush the `mullvad table`):

```
table inet filter
table inet exclude_mullvad

flush table inet exclude_mullvad
flush table inet filter
```

If you are familiar with `nftables` (if not, seriously, stop using iptables), you may be wondering about the `priority 99` for the postrouting hook (instead of the default [`srcnat`](https://wiki.nftables.org/wiki-nftables/index.php/Netfilter_hooks#:~:text=srcnat). It's because of the Mullvad app again :)

If you don't have the Mullvad app, you can just set:

```
 chain postrouting {
      type nat hook postrouting priority srcnat; policy accept;
      ip saddr $IP_PROXY snat ip to $IP_WAN_PROXY
    }
```

So this is this specific source NAT rule that changes the outbound IP to `172.16.10.100` for all the traffic from the `proxy` interface (i.e `192.168.10.1/24`).

> [!WARNING]
Using `iifname proxy` doesn't trigger a syntax error but the postrouting hook doesn't seem to properly support `iifname` . Using `ip saddr` works.

The `priority 99` is because the Mullvad VPN app adds a `nat` chain with the `postrouting` hook which do a masquerade for all the interface except `lo`. 

```cmd
root@host ~# nft list chain inet mullvad nat
table inet mullvad {
    chain nat {
        type nat hook postrouting priority srcnat; policy accept;
        oif "wg0-mullvad" ct mark 0x00000f41 drop
        oif != "lo" ct mark 0x00000f41 masquerade
    }
}
```

We could try to insert our SNAT rule first in this chain but it seems better to me to just make sure our SNAT rule triggers before and preventing the Mullvad one. `srcnat` = 100, so `99` will work ([cf. doc](https://wiki.nftables.org/wiki-nftables/index.php/Netfilter_hooks#:~:text=srcnat)).

The other rules added by Mullvad also block all traffic not going in the Wireguard tunnel. They do this by marking the packets. They explain how to exclude some traffic [in their documentation](https://mullvad.net/fr/help/split-tunneling-with-linux-advanced).

This is what leads to this:

```cmd
table inet exclude_mullvad {
  chain output {
    type route hook output priority -100; policy accept;
    ip saddr $IP_PROXY ct mark set 0x00000f41 meta mark set 0x6d6f6c65
  }
```

Make sure your firewall is enabled and restart it to apply the changes.

```cmd
me@host~> sudo systemctl enable nftables && sudo systemctl restart nftables
```

**STEP 5: Force our bubblejail traffic to use the proxy of the router**

On the router, you simply need to add a rule in a chain with the `prerouting` hook and low priority ([see documentation](https://wiki.nftables.org/wiki-nftables/index.php/Netfilter_hooks#:~:text=dstnat))

Here is extract of mine:

```
table inet raw {
  chain PREROUTING-stateless {
    # We can't add that to the ingress hook as that happens before IP defragmentation
    # so we don't have the TCP header in later fragments (we don't want to drop IP
    # fragments, see https://blog.cloudflare.com/ip-fragmentation-is-broken/ )
    type filter hook prerouting priority -399; policy accept; # > NF_IP_PRI_CONNTRACK_DEFRAG (-400)
   
    [...]

    ip saddr $IP_BUBBLEJAIL meta l4proto { tcp, udp } th dport != { 53, 4443 } drop
  }
```
with a `define IP_BUBBLEJAIL = 172.16.10.100` ahead in the config file.

The proxy listens on port `4443`  and I also allow 53 because the router forces all devices using port 53 to talk to my DNS server. This is the rule for 3 VLANS for instance:

```
chain prerouting {
     type nat hook prerouting priority dstnat; policy accept;

    ip daddr != 172.16.0.0/12 meta l4proto { tcp, udp } th dport 53 counter log flags all prefix "fw_hijack_dns " dnat ip to iifname map {
         $IF_VL_10 : 172.16.10.1,
         $IF_VL_20 : 172.16.20.1,
         $IF_VL_30 : 172.16.30.1
       }
     }
```

**STEP 6: Testing**

Let's see if it works!

Listen the DNS traffic of your internet interface:

```cmd
me@host~> sudo tcpdump -ni wlan0 port 53
tcpdump: verbose output suppressed, use -v[v]... for full protocol decode
listening on wlan0, link-type EN10MB (Ethernet), snapshot length 262144 bytes
```

Open a debug shell in the bubblejail profile : 

```
me@host~> bubblejail run --debug-shell firefox-proxy
```

```
sh-5.2$ drill @172.16.10.1 -DQ archlinux.org
95.217.163.246
```

It's our dedicated IP! Yeah! 

```
17:18:16.431185 IP 172.16.10.100.51208 > 172.16.10.1.53: 50962+ [1au] A? archlinux.org. (42)
17:18:16.433230 IP 172.16.10.1.53 > 172.16.10.100.51208: 50962 1/0/1 A 95.217.163.246 (58)
```

If we open a normal shell we should not see any DNS traffic (blocked by the Mullvad nftables rules to prevent DNS leak)

```cmd
me@host~> drill @172.16.10.1 -DQ archlinux.org
Error: error sending query: Error creating socket
```

And if we open a shell using the [split tunneling feature from the Mullvad VPN app](https://mullvad.net/fr/help/split-tunneling-with-the-mullvad-app),

```
me@host~> drill @172.16.10.1 -DQ archlinux.org
95.217.163.246
```

we see our main private IP `172.16.10.10`! :tada:
```
17:32:43.455178 IP 172.16.10.10.42937 > 172.16.10.1.53: 60951+ [1au] A? archlinux.org. (42)
17:32:43.457229 IP 172.16.10.1.53 > 172.16.10.10.42937: 60951 1/0/1 A 95.217.163.246 (58)
```

If we try to curl inside the bubblejail profile without specifying the proxy, it doesn't work:

```cmd
sh-5.2$ curl -m2 https://ifconfig.io
curl: (28) Connection timed out after 2001 milliseconds
```

It works with with the proxy:

```cmd
sh-5.2$ curl -I --proxy-http2 --proxy https://router.internal:4443 https://archlinux.org
HTTP/2 200
```

I hope I didn't do to much typo. I'll do a full test from scratch with this write-up tomorrow to catch them :bug:

**Reply by igo95862** [reply]
Interesting.

I wonder if you can avoid SNAT and directly forward packets from VLAN to router.

**Reply by 0x192** [reply]
Good point!  I'll try and will report back here but I'm not sure if it's possible as only 1 wifi connection can be activated at a time and I'll have at least 2 VLANs.
